"name","setting","unit","category","short_desc","extra_desc","context","vartype","source","min_val","max_val","enumvals","boot_val","reset_val","sourcefile","sourceline","pending_restart"
"wal_receiver_status_interval","10","s","Replication / Standby Servers","Sets the maximum interval between WAL receiver status reports to the sending server.",NULL,"sighup","integer","default","0","2147483",NULL,"10","10",NULL,NULL,False
"wal_receiver_timeout","60000","ms","Replication / Standby Servers","Sets the maximum wait time to receive data from the sending server.",NULL,"sighup","integer","default","0","2147483647",NULL,"60000","60000",NULL,NULL,False
"wal_recycle","on",NULL,"Write-Ahead Log / Settings","Recycles WAL files by renaming them.",NULL,"superuser","bool","default",NULL,NULL,NULL,"on","on",NULL,NULL,False
"wal_retrieve_retry_interval","5000","ms","Replication / Standby Servers","Sets the time to wait before retrying to retrieve WAL after a failed attempt.",NULL,"sighup","integer","default","1","2147483647",NULL,"5000","5000",NULL,NULL,False
"wal_segment_size","16777216","B","Preset Options","Shows the size of write ahead log segments.",NULL,"internal","integer","override","1048576","1073741824",NULL,"16777216","16777216",NULL,NULL,False
"wal_sender_timeout","60000","ms","Replication / Sending Servers","Sets the maximum time to wait for WAL replication.",NULL,"user","integer","default","0","2147483647",NULL,"60000","60000",NULL,NULL,False
"wal_skip_threshold","2048","kB","Write-Ahead Log / Settings","Size of new file to fsync instead of writing WAL.",NULL,"user","integer","default","0","2147483647",NULL,"2048","2048",NULL,NULL,False
"wal_sync_method","fdatasync",NULL,"Write-Ahead Log / Settings","Selects the method used for forcing WAL updates to disk.",NULL,"sighup","enum","default",NULL,NULL,"{fsync,fdatasync,open_sync,open_datasync}","fdatasync","fdatasync",NULL,NULL,False
"wal_writer_delay","200","ms","Write-Ahead Log / Settings","Time between WAL flushes performed in the WAL writer.",NULL,"sighup","integer","default","1","10000",NULL,"200","200",NULL,NULL,False
"wal_writer_flush_after","128","8kB","Write-Ahead Log / Settings","Amount of WAL written out by WAL writer that triggers a flush.",NULL,"sighup","integer","default","0","2147483647",NULL,"128","128",NULL,NULL,False
"work_mem","4096","kB","Resource Usage / Memory","Sets the maximum memory to be used for query workspaces.","This much memory can be used by each internal sort operation and hash table before switching to temporary disk files.","user","integer","default","64","2147483647",NULL,"4096","4096",NULL,NULL,False
"xmlbinary","base64",NULL,"Client Connection Defaults / Statement Behavior","Sets how binary values are to be encoded in XML.",NULL,"user","enum","default",NULL,NULL,"{base64,hex}","base64","base64",NULL,NULL,False
"xmloption","content",NULL,"Client Connection Defaults / Statement Behavior","Sets whether XML data in implicit parsing and serialization operations is to be considered as documents or content fragments.",NULL,"user","enum","default",NULL,NULL,"{content,document}","content","content",NULL,NULL,False
"zero_damaged_pages","off",NULL,"Developer Options","Continues processing past damaged page headers.","Detection of a damaged page header normally causes PostgreSQL to report an error, aborting the current transaction. Setting zero_damaged_pages to true causes the system to instead report a warning, zero out the damaged page, and continue processing. This behavior will destroy data, namely all the rows on the damaged page.","superuser","bool","default",NULL,NULL,NULL,"off","off",NULL,NULL,False
